{
  "problem_id": "IMO2026-P6",
  "manuscript": {
    "filename": "IMO2026_Day2_Problem6.pdf",
    "sha256": "06b2172ce6366f814daea5fb1a46824239f94d5cf3ddabf6d075dc6ca1002681",
    "created_at": "2026-07-16",
    "original_path": "/Users/os/Downloads/IMO2026/IMO2026_Day2_Problem6.pdf",
    "provenance_status": "PARTIAL",
    "claimed_authors": []
  },
  "official_binding": {
    "source_sha256": "cbe3015874c360049cd405840bbb4bb1b80e951e51028ec732b21d67f46a1095",
    "statement_match": "MATCH"
  },
  "exposure": {
    "human": {
      "official_solution_exposure": "UNKNOWN",
      "unofficial_external_solution_exposure": "UNKNOWN",
      "internal_project_solution_exposure": "UNKNOWN",
      "search_history_exposure": "UNKNOWN",
      "blind_reconstruction_eligible": "UNKNOWN",
      "notes": "Owner attestation pending. Legacy manuscripts exist, so eligibility not established. Unknown is not false."
    },
    "sol": {
      "official_solution_exposure": false,
      "unofficial_external_solution_exposure": false,
      "internal_project_solution_exposure": true,
      "search_history_exposure": "UNKNOWN",
      "blind_reconstruction_eligible": false,
      "notes": "Sol read all six manuscripts during the deep dive; internal-project exposure TRUE; not eligible as blind reconstruction actor."
    },
    "fable": {
      "official_solution_exposure": false,
      "unofficial_external_solution_exposure": false,
      "internal_project_solution_exposure": true,
      "search_history_exposure": false,
      "blind_reconstruction_eligible": false,
      "notes": "Fable extracted full text of all six manuscripts during S0-R; internal-project exposure TRUE. Only official statements were fetched from the organiser. Not eligible as blind reconstruction actor."
    }
  },
  "proof_obligations": [
    {
      "id": "O1",
      "claim": "Greedy sequence = increasing enumeration of admissible set A",
      "status": "CLAIMED",
      "dependencies": [],
      "load_bearing": true,
      "notes": ""
    },
    {
      "id": "O2",
      "claim": "A is upward-closed under divisibility and pairwise non-coprime",
      "status": "CLAIMED",
      "dependencies": [
        "O1"
      ],
      "load_bearing": true,
      "notes": ""
    },
    {
      "id": "O3",
      "claim": "Minimal kernels; A = union of b*N over kernels",
      "status": "CLAIMED",
      "dependencies": [
        "O2"
      ],
      "load_bearing": false,
      "notes": ""
    },
    {
      "id": "O4",
      "claim": "Witness-before-power lemma: a_j < d^s",
      "status": "CLAIMED",
      "dependencies": [
        "O1"
      ],
      "load_bearing": true,
      "notes": ""
    },
    {
      "id": "O5",
      "claim": "Prime bound p < a_1^2 -> finitely many kernels",
      "status": "CLAIMED",
      "dependencies": [
        "O3",
        "O4"
      ],
      "load_bearing": true,
      "notes": ""
    },
    {
      "id": "O6",
      "claim": "Translation periodicity a_{n+T} = a_n + L",
      "status": "CLAIMED",
      "dependencies": [
        "O5"
      ],
      "load_bearing": false,
      "notes": ""
    }
  ],
  "audit_status": "RECONCILED"
}
