{
  "problem_id": "IMO2026-P3",
  "manuscript": {
    "filename": "IMO2026_Day1_Problem3.pdf",
    "sha256": "74bfa6311fcab1897a977f3969de2a886ad5e9e901ef343f1b530275b67c9206",
    "created_at": "2026-07-16",
    "original_path": "/Users/os/Downloads/IMO2026/IMO2026_Day1_Problem3.pdf",
    "provenance_status": "PARTIAL",
    "claimed_authors": []
  },
  "official_binding": {
    "source_sha256": "cbe3015874c360049cd405840bbb4bb1b80e951e51028ec732b21d67f46a1095",
    "statement_match": "MATCH"
  },
  "exposure": {
    "human": {
      "official_solution_exposure": "UNKNOWN",
      "unofficial_external_solution_exposure": "UNKNOWN",
      "internal_project_solution_exposure": "UNKNOWN",
      "search_history_exposure": "UNKNOWN",
      "blind_reconstruction_eligible": "UNKNOWN",
      "notes": "Owner attestation pending. Legacy manuscripts exist, so eligibility not established. Unknown is not false."
    },
    "sol": {
      "official_solution_exposure": false,
      "unofficial_external_solution_exposure": false,
      "internal_project_solution_exposure": true,
      "search_history_exposure": "UNKNOWN",
      "blind_reconstruction_eligible": false,
      "notes": "Sol read all six manuscripts during the deep dive; internal-project exposure TRUE; not eligible as blind reconstruction actor."
    },
    "fable": {
      "official_solution_exposure": false,
      "unofficial_external_solution_exposure": false,
      "internal_project_solution_exposure": true,
      "search_history_exposure": false,
      "blind_reconstruction_eligible": false,
      "notes": "Fable extracted full text of all six manuscripts during S0-R; internal-project exposure TRUE. Only official statements were fetched from the organiser. Not eligible as blind reconstruction actor."
    }
  },
  "proof_obligations": [
    {
      "id": "O1",
      "claim": "Fixed-partition game value V=(1+Delta)/2 with pairing strategy",
      "status": "CLAIMED",
      "dependencies": [],
      "load_bearing": true,
      "notes": ""
    },
    {
      "id": "O2",
      "claim": "Candidate optimum c_n = 2^n/(2^{n+1}-1)",
      "status": "CLAIMED",
      "dependencies": [
        "O1"
      ],
      "load_bearing": false,
      "notes": ""
    },
    {
      "id": "O3",
      "claim": "Upper bound: subset-sum proximity + pairing cut budget <= n",
      "status": "CLAIMED",
      "dependencies": [
        "O1"
      ],
      "load_bearing": true,
      "notes": ""
    },
    {
      "id": "O4",
      "claim": "Lower bound: powers of two + tree two-colouring, |R|>=1",
      "status": "CLAIMED",
      "dependencies": [
        "O1"
      ],
      "load_bearing": true,
      "notes": ""
    },
    {
      "id": "O5",
      "claim": "Pairing bound |R| <= Delta'",
      "status": "CLAIMED",
      "dependencies": [
        "O4"
      ],
      "load_bearing": true,
      "notes": ""
    },
    {
      "id": "O6",
      "claim": "Bounds meet at c_n",
      "status": "CLAIMED",
      "dependencies": [
        "O3",
        "O5"
      ],
      "load_bearing": false,
      "notes": ""
    }
  ],
  "audit_status": "RECONCILED"
}
