{
  "problem_id": "IMO2026-P2",
  "manuscript": {
    "filename": "IMO2026_Day1_Problem2.pdf",
    "sha256": "c10b9120459dd1c06b06e316c76d91d2ff9031f8385cbaa4c6085722b20f4855",
    "created_at": "2026-07-16",
    "original_path": "/Users/os/Downloads/IMO2026/IMO2026_Day1_Problem2.pdf",
    "provenance_status": "PARTIAL",
    "claimed_authors": []
  },
  "official_binding": {
    "source_sha256": "cbe3015874c360049cd405840bbb4bb1b80e951e51028ec732b21d67f46a1095",
    "statement_match": "MATCH"
  },
  "exposure": {
    "human": {
      "official_solution_exposure": "UNKNOWN",
      "unofficial_external_solution_exposure": "UNKNOWN",
      "internal_project_solution_exposure": "UNKNOWN",
      "search_history_exposure": "UNKNOWN",
      "blind_reconstruction_eligible": "UNKNOWN",
      "notes": "Owner attestation pending. Legacy manuscripts exist, so eligibility not established. Unknown is not false."
    },
    "sol": {
      "official_solution_exposure": false,
      "unofficial_external_solution_exposure": false,
      "internal_project_solution_exposure": true,
      "search_history_exposure": "UNKNOWN",
      "blind_reconstruction_eligible": false,
      "notes": "Sol read all six manuscripts during the deep dive; internal-project exposure TRUE; not eligible as blind reconstruction actor."
    },
    "fable": {
      "official_solution_exposure": false,
      "unofficial_external_solution_exposure": false,
      "internal_project_solution_exposure": true,
      "search_history_exposure": false,
      "blind_reconstruction_eligible": false,
      "notes": "Fable extracted full text of all six manuscripts during S0-R; internal-project exposure TRUE. Only official statements were fetched from the organiser. Not eligible as blind reconstruction actor."
    }
  },
  "proof_obligations": [
    {
      "id": "O1",
      "claim": "Reflection K',L' give cyclic quads (A,C,K,K') and (A,B,L,L')",
      "status": "CLAIMED",
      "dependencies": [],
      "load_bearing": true,
      "notes": ""
    },
    {
      "id": "O2",
      "claim": "Antipode reduction: OM=ON iff DB=DC",
      "status": "CLAIMED",
      "dependencies": [
        "O1"
      ],
      "load_bearing": false,
      "notes": ""
    },
    {
      "id": "O3",
      "claim": "Coordinate parameterization of the configuration",
      "status": "CLAIMED",
      "dependencies": [
        "O1"
      ],
      "load_bearing": false,
      "notes": ""
    },
    {
      "id": "O4",
      "claim": "Non-degeneracy Delta != 0",
      "status": "CLAIMED",
      "dependencies": [
        "O3"
      ],
      "load_bearing": true,
      "notes": ""
    },
    {
      "id": "O5",
      "claim": "Load-bearing identity Delta*G = Q_K*E_K + Q_L*E_L",
      "status": "CLAIMED",
      "dependencies": [
        "O3"
      ],
      "load_bearing": true,
      "notes": ""
    },
    {
      "id": "O6",
      "claim": "Conclude DB=DC hence OM=ON",
      "status": "CLAIMED",
      "dependencies": [
        "O2",
        "O4",
        "O5"
      ],
      "load_bearing": false,
      "notes": ""
    }
  ],
  "audit_status": "RECONCILED"
}
