{
  "problem_id": "IMO2026-P4",
  "manuscript": {
    "filename": "IMO2026_Day2_Problem4.pdf",
    "sha256": "2f78c72a43e9d5248247e412c57f9d393a7650314a6371a354bffd0fdb940cfa",
    "created_at": "2026-07-16",
    "original_path": "/Users/os/Downloads/IMO2026/IMO2026_Day2_Problem4.pdf",
    "provenance_status": "PARTIAL",
    "claimed_authors": []
  },
  "official_binding": {
    "source_sha256": "cbe3015874c360049cd405840bbb4bb1b80e951e51028ec732b21d67f46a1095",
    "statement_match": "MATCH"
  },
  "exposure": {
    "human": {
      "official_solution_exposure": "UNKNOWN",
      "unofficial_external_solution_exposure": "UNKNOWN",
      "internal_project_solution_exposure": "UNKNOWN",
      "search_history_exposure": "UNKNOWN",
      "blind_reconstruction_eligible": "UNKNOWN",
      "notes": "Owner attestation pending. Legacy manuscripts exist, so eligibility not established. Unknown is not false."
    },
    "sol": {
      "official_solution_exposure": false,
      "unofficial_external_solution_exposure": false,
      "internal_project_solution_exposure": true,
      "search_history_exposure": "UNKNOWN",
      "blind_reconstruction_eligible": false,
      "notes": "Sol read all six manuscripts during the deep dive; internal-project exposure TRUE; not eligible as blind reconstruction actor."
    },
    "fable": {
      "official_solution_exposure": false,
      "unofficial_external_solution_exposure": false,
      "internal_project_solution_exposure": true,
      "search_history_exposure": false,
      "blind_reconstruction_eligible": false,
      "notes": "Fable extracted full text of all six manuscripts during S0-R; internal-project exposure TRUE. Only official statements were fetched from the organiser. Not eligible as blind reconstruction actor."
    }
  },
  "proof_obligations": [
    {
      "id": "O1",
      "claim": "Normalized cut-state formulas (b,x,q-b-x) and (c,a-x,b+x)",
      "status": "CLAIMED",
      "dependencies": [],
      "load_bearing": true,
      "notes": ""
    },
    {
      "id": "O2",
      "claim": "Integer k in (b,a+b) forces an integer-multiple angle in both branches",
      "status": "CLAIMED",
      "dependencies": [
        "O1"
      ],
      "load_bearing": true,
      "notes": ""
    },
    {
      "id": "O3",
      "claim": "Monovariant m -> m-1 forces m=1 when q integer (Mulan wins)",
      "status": "CLAIMED",
      "dependencies": [
        "O2"
      ],
      "load_bearing": false,
      "notes": ""
    },
    {
      "id": "O4",
      "claim": "Noninteger invariant preserved by >=1 branch when q not integer",
      "status": "CLAIMED",
      "dependencies": [
        "O1"
      ],
      "load_bearing": true,
      "notes": ""
    },
    {
      "id": "O5",
      "claim": "Classification theta = 180/n, n>=2",
      "status": "CLAIMED",
      "dependencies": [
        "O3",
        "O4"
      ],
      "load_bearing": false,
      "notes": ""
    }
  ],
  "audit_status": "RECONCILED"
}
